{
  "name": "Apple iPad Air 2 64GB Wi-Fi",
  "brand": "Apple",
  "model": "iPad Air 2 (A1566)",
  "category": "Electronics > Tablets",
  "condition": "good",
  "attributes": ["64GB", "Space Gray", "Wi-Fi only", "no charger visible"],
  "search_query": "Apple iPad Air 2 64GB Wi-Fi",
  "confidence": 0.86,
  "notes": "Light scuffs on the aluminium back. Screen looks intact."
}
